{
  "schema_version": "rag_forensic_capture_v1",
  "forensic_request_id": "bedd3eebd5bb41a1a9bae3c6d2203a21",
  "query_hash": "f7b5b22acce69f5c215b0245c0ef4f011dce3d68ecdc59a79ec1b4dde16ae69f",
  "raw_text_enabled": true,
  "stages": {
    "retrieval": {
      "candidate_count": 15,
      "authorized_candidate_count": 15,
      "configured_top_k": 15,
      "rrf_top20_observed": [
        {
          "rank": 1,
          "chunk_id": "c79faf52-4843-5b5e-afb1-8c6ab6586b9b",
          "source_id": "nimbus_api_reference_md",
          "section_key": [
            "Authentication"
          ],
          "score": 1.0,
          "document_version": "3ca423baeb9bb247a5142cec2a10bb539fb982b1403486083a1c34f36169ad74",
          "authorized": true
        },
        {
          "rank": 2,
          "chunk_id": "5a74fffa-7936-5ab8-b475-cd48dbe12e7e",
          "source_id": "nimbus_api_reference_md",
          "section_key": [
            "Authentication Scopes"
          ],
          "score": 0.53333336,
          "document_version": "3ca423baeb9bb247a5142cec2a10bb539fb982b1403486083a1c34f36169ad74",
          "authorized": true
        },
        {
          "rank": 3,
          "chunk_id": "8c731673-dd92-5ce7-b4f5-7f4168c69bab",
          "source_id": "nimbus_cli_md",
          "section_key": [
            "Kimlik Doğrulama",
            "Token Süresi"
          ],
          "score": 0.4761905,
          "document_version": "da1b89a519d7bf7c091ac98cff0cb2a870591fd3954f82faf81af0fa7cb90d6b",
          "authorized": true
        },
        {
          "rank": 4,
          "chunk_id": "e2a38574-444e-5491-a0b7-c70fbd0887c0",
          "source_id": "nimbus_cli_md",
          "section_key": [
            "Kimlik Doğrulama"
          ],
          "score": 0.39285713,
          "document_version": "da1b89a519d7bf7c091ac98cff0cb2a870591fd3954f82faf81af0fa7cb90d6b",
          "authorized": true
        },
        {
          "rank": 5,
          "chunk_id": "ae16f59c-ce7c-5cdb-a755-a9e6181da754",
          "source_id": "nimbus_handbook_pdf",
          "section_key": [],
          "score": 0.30555555,
          "document_version": "cec6424af77e2a2b37238ad221db39717431cf74e7beae037f28a3bae8109930",
          "authorized": true
        },
        {
          "rank": 6,
          "chunk_id": "e657a674-01a3-5b6d-8ca7-d796a25fc546",
          "source_id": "nimbus_cli_md",
          "section_key": [
            "Sorun Giderme"
          ],
          "score": 0.24761905,
          "document_version": "da1b89a519d7bf7c091ac98cff0cb2a870591fd3954f82faf81af0fa7cb90d6b",
          "authorized": true
        },
        {
          "rank": 7,
          "chunk_id": "5ff06d00-e51b-5de1-811f-41640f4cb05c",
          "source_id": "nimbus_api_reference_md",
          "section_key": [
            "Webhooks"
          ],
          "score": 0.23809525,
          "document_version": "3ca423baeb9bb247a5142cec2a10bb539fb982b1403486083a1c34f36169ad74",
          "authorized": true
        },
        {
          "rank": 8,
          "chunk_id": "d2c81acd-2ce1-5f77-adb3-1b9dee5532c7",
          "source_id": "nimbus_api_reference_md",
          "section_key": [
            "API Versioning"
          ],
          "score": 0.17777778,
          "document_version": "3ca423baeb9bb247a5142cec2a10bb539fb982b1403486083a1c34f36169ad74",
          "authorized": true
        },
        {
          "rank": 9,
          "chunk_id": "83495c19-04f6-50d9-a6dd-5e6ea126db5b",
          "source_id": "nimbus_handbook_pdf",
          "section_key": [],
          "score": 0.17142858,
          "document_version": "cec6424af77e2a2b37238ad221db39717431cf74e7beae037f28a3bae8109930",
          "authorized": true
        },
        {
          "rank": 10,
          "chunk_id": "32b18d41-8af4-57b6-b535-d4027a80c21e",
          "source_id": "nimbus_kurumsal_sss_md",
          "section_key": [
            "Destek Yanıt Süreleri"
          ],
          "score": 0.16666667,
          "document_version": "092ae15e016d11d767d6feef9fb1f0167ee6a2a56e52270d1e46aa29f347b914",
          "authorized": true
        },
        {
          "rank": 11,
          "chunk_id": "4817766f-f27d-54c5-ad6d-84892318d085",
          "source_id": "nimbus_api_reference_md",
          "section_key": [
            "Rate Limits"
          ],
          "score": 0.16025642,
          "document_version": "3ca423baeb9bb247a5142cec2a10bb539fb982b1403486083a1c34f36169ad74",
          "authorized": true
        },
        {
          "rank": 12,
          "chunk_id": "6d591d7b-9f4e-5e2e-8f68-a7cfcce758b1",
          "source_id": "nimbus_kurumsal_sss_md",
          "section_key": [
            "Özel Entegrasyonlar"
          ],
          "score": 0.15263158,
          "document_version": "092ae15e016d11d767d6feef9fb1f0167ee6a2a56e52270d1e46aa29f347b914",
          "authorized": true
        },
        {
          "rank": 13,
          "chunk_id": "8374b305-9469-55d5-9560-c4c75c10c475",
          "source_id": "nimbus_kurumsal_sss_md",
          "section_key": [
            "Tek Oturum Açma"
          ],
          "score": 0.14583334,
          "document_version": "092ae15e016d11d767d6feef9fb1f0167ee6a2a56e52270d1e46aa29f347b914",
          "authorized": true
        },
        {
          "rank": 14,
          "chunk_id": "032d0e3b-c551-5bbf-b0f3-5a050d8f247c",
          "source_id": "nimbus_cli_md",
          "section_key": [
            "Kurulum"
          ],
          "score": 0.13942307,
          "document_version": "da1b89a519d7bf7c091ac98cff0cb2a870591fd3954f82faf81af0fa7cb90d6b",
          "authorized": true
        },
        {
          "rank": 15,
          "chunk_id": "c0aa40e4-4b9e-5efa-bd06-6914fae99660",
          "source_id": "nimbus_api_reference_md",
          "section_key": [
            "Idempotency"
          ],
          "score": 0.125,
          "document_version": "3ca423baeb9bb247a5142cec2a10bb539fb982b1403486083a1c34f36169ad74",
          "authorized": true
        }
      ],
      "stage_timings_ms": {
        "query_embedding": 324.2596669588238,
        "sparse_encoding": 0.2882080152630806,
        "hybrid_retrieval": 12.560583185404539,
        "rerank": 1191.7138339485973
      }
    },
    "reranker": {
      "input_candidate_ids": [
        "c79faf52-4843-5b5e-afb1-8c6ab6586b9b",
        "5a74fffa-7936-5ab8-b475-cd48dbe12e7e",
        "8c731673-dd92-5ce7-b4f5-7f4168c69bab",
        "e2a38574-444e-5491-a0b7-c70fbd0887c0",
        "ae16f59c-ce7c-5cdb-a755-a9e6181da754",
        "e657a674-01a3-5b6d-8ca7-d796a25fc546",
        "5ff06d00-e51b-5de1-811f-41640f4cb05c",
        "d2c81acd-2ce1-5f77-adb3-1b9dee5532c7",
        "83495c19-04f6-50d9-a6dd-5e6ea126db5b",
        "32b18d41-8af4-57b6-b535-d4027a80c21e",
        "4817766f-f27d-54c5-ad6d-84892318d085",
        "6d591d7b-9f4e-5e2e-8f68-a7cfcce758b1",
        "8374b305-9469-55d5-9560-c4c75c10c475",
        "032d0e3b-c551-5bbf-b0f3-5a050d8f247c",
        "c0aa40e4-4b9e-5efa-bd06-6914fae99660"
      ],
      "output_candidate_ids": [
        "c79faf52-4843-5b5e-afb1-8c6ab6586b9b",
        "8c731673-dd92-5ce7-b4f5-7f4168c69bab",
        "e2a38574-444e-5491-a0b7-c70fbd0887c0",
        "5a74fffa-7936-5ab8-b475-cd48dbe12e7e",
        "c0aa40e4-4b9e-5efa-bd06-6914fae99660"
      ],
      "bge_top5_observed": [
        {
          "rank": 1,
          "chunk_id": "c79faf52-4843-5b5e-afb1-8c6ab6586b9b",
          "source_id": "nimbus_api_reference_md",
          "section_key": [
            "Authentication"
          ],
          "score": 0.9767642617225647,
          "document_version": "3ca423baeb9bb247a5142cec2a10bb539fb982b1403486083a1c34f36169ad74",
          "authorized": true
        },
        {
          "rank": 2,
          "chunk_id": "8c731673-dd92-5ce7-b4f5-7f4168c69bab",
          "source_id": "nimbus_cli_md",
          "section_key": [
            "Kimlik Doğrulama",
            "Token Süresi"
          ],
          "score": 0.03079083561897278,
          "document_version": "da1b89a519d7bf7c091ac98cff0cb2a870591fd3954f82faf81af0fa7cb90d6b",
          "authorized": true
        },
        {
          "rank": 3,
          "chunk_id": "e2a38574-444e-5491-a0b7-c70fbd0887c0",
          "source_id": "nimbus_cli_md",
          "section_key": [
            "Kimlik Doğrulama"
          ],
          "score": 0.003314896719530225,
          "document_version": "da1b89a519d7bf7c091ac98cff0cb2a870591fd3954f82faf81af0fa7cb90d6b",
          "authorized": true
        },
        {
          "rank": 4,
          "chunk_id": "5a74fffa-7936-5ab8-b475-cd48dbe12e7e",
          "source_id": "nimbus_api_reference_md",
          "section_key": [
            "Authentication Scopes"
          ],
          "score": 0.0031068027019500732,
          "document_version": "3ca423baeb9bb247a5142cec2a10bb539fb982b1403486083a1c34f36169ad74",
          "authorized": true
        },
        {
          "rank": 5,
          "chunk_id": "c0aa40e4-4b9e-5efa-bd06-6914fae99660",
          "source_id": "nimbus_api_reference_md",
          "section_key": [
            "Idempotency"
          ],
          "score": 0.00284927268512547,
          "document_version": "3ca423baeb9bb247a5142cec2a10bb539fb982b1403486083a1c34f36169ad74",
          "authorized": true
        }
      ]
    },
    "evidence_build": {
      "input_chunk_ids": [
        "c79faf52-4843-5b5e-afb1-8c6ab6586b9b",
        "8c731673-dd92-5ce7-b4f5-7f4168c69bab",
        "e2a38574-444e-5491-a0b7-c70fbd0887c0",
        "5a74fffa-7936-5ab8-b475-cd48dbe12e7e",
        "c0aa40e4-4b9e-5efa-bd06-6914fae99660"
      ],
      "contributing_chunk_ids": [
        "c79faf52-4843-5b5e-afb1-8c6ab6586b9b",
        "4817766f-f27d-54c5-ad6d-84892318d085",
        "a565fb6c-21af-58ef-b4ff-935fa61b648a",
        "5ff06d00-e51b-5de1-811f-41640f4cb05c",
        "ff2742dc-ef8b-530c-bee0-b58011b7fc27",
        "d2c81acd-2ce1-5f77-adb3-1b9dee5532c7",
        "48c803ae-178b-55d0-9c7b-ca474a0e5c5b",